Title,Content,Summary,Category
Introducing the LuxWood Flooring Line,"Discover our new LuxWood flooring, crafted from high-quality materials that provide a rich, luxurious appearance. Designed to withstand heavy use while maintaining elegance, this flooring is perfect for high-traffic areas. It comes in a variety of finishes to match any style.","New high-quality, durable flooring ideal for elegant, high-traffic areas.",Latest RSH Products
Elegant Marble Countertops Now Available,"Our new marble countertop collection offers timeless elegance for your kitchen and bathroom spaces. These countertops are available in a range of natural shades and unique patterns, adding sophistication and a luxurious touch to your home renovation projects.",Timeless marble countertops for elegant kitchens and bathrooms.,Latest RSH Products
Smart Home Lighting Solutions,Upgrade your home with our new line of smart lighting solutions. These fixtures offer adjustable lighting to match your mood and are compatible with all major smart home systems. Effortlessly control your lighting from your phone or through voice commands for ultimate convenience.,New smart lighting options for mood customization and easy control.,Latest RSH Products
Premium Outdoor Living Collection,"Explore our exclusive collection of outdoor living products, including luxury patio furniture, weather-resistant materials, and elegant outdoor decor. Create an inviting outdoor space that blends comfort and style, perfect for gatherings or a quiet retreat.",High-end outdoor furniture and decor for stylish outdoor living spaces.,Latest RSH Products
Smart Thermostats: Energy Efficiency Boost,"Discover our latest range of smart thermostats designed to optimize energy usage and reduce costs. These devices learn your habits, adjust heating and cooling automatically, and can be controlled remotely via mobile app, making it easier to maintain the perfect home temperature.",New smart thermostats for improved energy efficiency and convenience.,Tech Updates
Home Security: Advanced Camera Systems,"We're excited to introduce the latest in home security: advanced camera systems with AI-enhanced detection features. These cameras offer high-definition video, night vision, and facial recognition capabilities to provide enhanced safety and peace of mind for your home.",Advanced AI-powered security cameras with HD video and night vision.,Tech Updates
Voice-Activated Kitchen Appliances,"Experience the future of home cooking with our new voice-activated kitchen appliances. From smart ovens that preheat on command to intelligent refrigerators that track food inventory, these devices are designed to make meal prep more efficient and enjoyable.",Voice-activated kitchen devices for a more efficient cooking experience.,Tech Updates
Upgraded Solar Panel Systems,"Check out our latest solar panel systems, now with increased efficiency and a sleeker design. These panels are perfect for sustainable living, offering improved energy output and a more streamlined look that integrates seamlessly with modern home exteriors.",Enhanced solar panels for better efficiency and a stylish appearance.,Tech Updates
Open House at Our New Showroom,Join us for an exclusive Open House at our brand-new showroom. Explore our latest home renovation products and get personalized advice from our design experts. Enjoy complimentary refreshments and a chance to win a free consultation with our top interior designer.,Open House event at our new showroom with exclusive offers.,Upcoming Events
Webinar: Smart Home Innovations,"We’re hosting a free webinar to discuss the latest trends in smart home technology. Our experts will guide you through the benefits of smart devices, and you’ll get a sneak peek at our upcoming products. Don't miss out on live demonstrations and a Q&A session!",Free webinar on the latest smart home technology trends.,Upcoming Events
VIP Client Appreciation Night,We are excited to invite our VIP clients to an exclusive evening of cocktails and networking. This special event is our way of saying thank you for your continued support. Enjoy a preview of our upcoming collections and a chance to meet our design and construction team in person.,VIP client appreciation event with a preview of new designs.,Upcoming Events
Sustainability Workshop,"Attend our hands-on workshop focused on sustainable home practices. Our experts will provide tips on eco-friendly materials, energy-saving techniques, and more. This workshop is perfect for anyone looking to make their home greener without sacrificing style.",Workshop on sustainable home practices and eco-friendly tips.,Upcoming Events
Introducing Recycled Material Options,"We’re proud to announce our new line of products featuring high-quality recycled materials. From countertops to flooring, these eco-friendly options provide the same durability and style you expect, with a significantly reduced environmental impact.",New recycled material options for home renovations.,Sustainability Updates
Solar Energy Initiatives for 2024,"Starting next year, we’re launching new solar energy initiatives aimed at making homes more sustainable. Our enhanced solar panel systems will include improved efficiency and integration options, making them accessible for more households.",New solar energy initiatives to improve home sustainability.,Sustainability Updates
Water Conservation Tips for Homeowners,"Discover simple and effective ways to reduce water usage in your home without compromising comfort. From low-flow fixtures to smart irrigation systems, we’ve gathered the best practices for eco-conscious living.",Tips for reducing water usage at home while maintaining comfort.,Sustainability Updates
Eco-Friendly Paints Now Available,"We’re excited to introduce our new range of eco-friendly paints, free of harmful chemicals and perfect for creating beautiful, healthy living spaces. Available in a variety of colors and finishes, these paints are both stylish and environmentally responsible.",New eco-friendly paints for stylish and healthy living.,Sustainability Updates
The Rise of Open-Concept Living Spaces,"Open-concept designs are becoming more popular as homeowners seek to create fluid, multifunctional areas. Learn how our latest projects are embracing this trend with innovative layouts that combine style and functionality, perfect for both everyday living and entertaining.",Open-concept living spaces gaining popularity.,Latest Trends
Bold Colors Making a Comeback in 2024,"Say goodbye to neutral tones—bold colors are making a big return in home design. Discover how to incorporate rich hues like emerald green, deep navy, and terracotta into your space for a sophisticated yet lively atmosphere.",Bold colors trending in home design for 2024.,Latest Trends
Sustainable Luxury: Eco-Friendly Materials with a Premium Look,"Sustainable design doesn’t mean sacrificing luxury. See how eco-friendly materials like reclaimed wood, bamboo, and recycled metals are being used to create high-end finishes that are both beautiful and kind to the planet.",Eco-friendly materials blending sustainability and luxury.,Latest Trends
Smart Lighting: The Future of Interior Design,"Smart lighting systems are changing the way we experience our homes. From adjustable LED lights to voice-controlled ambient settings, find out how this technology can transform your living space into a comfortable and energy-efficient haven.",Smart lighting technology transforming home interiors.,Latest Trends
